customer_id,review_id,product_parent,star_rating,helpful_votes,total_votes,vine,review_headline,review_body,review_date
22247610,RAXLUANX890H,544821753,1,0,0,N,Samsung customer support has been terrible. This is not the first time I have ...,This microwave came with the house I purchased 6 months ago. Manufacture date is Nov 2013. It stopped working for no reason. No error message. Outlet still works. Samsung customer support has been terrible. This is not the first time I have a problem with samsung appliances. Only thing they seem to do right are TV's. I recommend buying a different microwave.,3/21/2015
24939219,R3DWYZQFJ8GCID,544821753,1,0,0,N,"Danger, do no buy.","After two years, the microwave died yesterday involved in black smoke. Luckily we were able to manage  the mess before the whole house burned down. Stay away from this company.",12/11/2014
36745294,R1QYKMRAETXE1K,544821753,2,0,0,N,I'm amazed that Samsung continued with the same faulty design model ...,"Although I bought an older model (SMH9187ST), I'm adding a review here because of the SE error plague w/ Samsung microwaves in general.  I'm amazed that Samsung continued with the same faulty design model after model ... and it says something that when I called Samsung, they said the SE error was under warranty for my unit which was manufactured 5 years ago.<br /><br />They set up a repair for two weeks from now, but if it happens again I won't go through another repair, even free, will just replace with a non-Samsung microwave.  The only reason I got 5 years out of it is that I split my time between two residences, and actual live-in usage at this home has been only about 2.5 years.",10/8/2014
11083181,RSCQIQA1FUSCC,544821753,1,0,0,N,Unsafe product,Bought th microwave about 24 months ago and it died last night.  No error but smell of electrical material was evident.  I was fearfully of a fire breaking out.  We unplugged it and called samsung.  They instructed us in troubleshooting but to no avail.  I then started to read reviews and now I plan to replace with another brand because this is a dangerous<br />Appliance.  Definitely not worth repairing for both financial and safety reasons.  I advise not yo buy samsung this appliance should have been recalled,9/19/2014
29083622,R20P9L37S796TG,544821753,1,0,0,N,Great when it works,"This may or may not be a solution for you but it worked for me.<br />My SMH8165ST was purchased in January of 2012. In March of 2014 it started having the SE errors and similar to others on this site, would start on its own, night light would go off and on on its own, beep every 15 minutes, etc.<br />I tried all of the YouTube and other suggestions with removing the circuit board, cleaning all the connections. Originally this worked for two weeks, and then the problems restarted. Kept on repeating the process for the next 2  months with the time interval getting shorter and shorter between cleanings.<br />The last time I left the power on when reinstalling the panel and the system worked fine. Oops, forgot to reinstall the circuit board mounting bracket.<br />Reinstalled the panel with the mounting bracket, again with live power and the SE error came on instantly.<br />Repeated the process three times, no errors without the circuit board mounting bracket; SE errors with the Circuit board mounting bracket.<br />With a large magnifying glass, I discovered a very, very small scratch on the ribbon cable between the circuit board and the control panel. This scratch lines up with a very sharp edge on the circuit board mounting bracket and it seemed that through vibration and general use; the ribbon cable was starting the have a direct contact between the embedded wires in the ribbon cable and the sharp edge of the mounting bracket, more than likely causing the strange SE errors.<br />I covered the sharp edge on the mounting bracket with electricians tape, as well as the ribbon cable where it bent around the mounting bracket projection.<br />Then while reinstalling the panel with live power, I tried twisting the panel, hitting it against the edge of the microwave, jiggling all the wires and all sorts of moves to see if the SE error would show up. No errors showed up.<br />The microwave has been working perfectly for two months now. It my case it is most likely that the manufacturing process was at fault for installing the ribbon cable tight against a sharp edge of the circuit board mounting bracket.<br />I would give this microwave 4 stars if it wasn't for the poor quality control during manufacturing.e manufacturing process was at fault for installing the ribbon cable tight against a sharp edge of the circuit board mounting bracket.<br />I would give this microwave 4 stars if it wasn't for the poor quality control during manufacturing.",7/28/2014
36332906,RLC4M1VKMJSNB,544821753,1,0,0,N,What a rip off! DO NOT BUY SAMSUNG MICROWAVE OVENS...!!!,I am only adding my review so that I can lower the star count on this piece of garbage. I have no new information to add that has not already been thoroughly covered by the other reviewers. I also have the SE error and my microwave that just recently went out of warranty is now useless. DO NOT BUY SAMSUNG MICROWAVE OVENS...!!!,7/25/2014
51367435,R2FXF4JSMMEPY8,544821753,2,0,0,N,Terrible user interface compared to GE; dim light and worthless timer.,"I wanted to replace our GE SpaceMaker over-the-range 30 microwave and found this model that matched well.  (We actually have the black version, but it is otherwise identical.)  The Samsung obviously shares the same basic design as the GE with a redesigned front panel.  I knew and trusted the Samsung brand from our personal electronics (such as several smartphones), so picked one of these up on sale at a local retailer.  Unfortunately, what I got was a bare-bones minimal redesign with major flaws.  It's like they took the basic GE design, made it super cheap, and replaced the panel with a terrible non-intuitive redesign.<br /><br />Installation was easy - I was even able to use the original rear mounting plate as the Samsung was, indeed, a twin of the GE series.  This microwave fit perfectly into our 30 wide opening with very minimal gaps on each side.  I had to drill new holes through the cabinet above, however, as the top was slightly different.  The height is 16 for the main cabinet, 16 5/8 to the very bottom of the light box underneath (not shown in the picture, but it's there).  I plugged it in and quickly realized that this sure isn't the same quality as the GE was.<br /><br />The first and most annoying thing is the user interface on the front panel.  The buttons are hard to interpret, and things that are easy on the GE are now impossible or very confusing.  Heating a beverage is common, right?  No beverage button on this unit - you need to discover the button to press is COOK, and then wait for the slowly scrolling text to confirm you are correct and need to press 1 next.<br /><br />What about canned vegetables?  There's a VEGGIES button, so this should be easy.  Not so!  Press the button, and across scrolls: SELECT ... (pause) ... 1 FOR ... (pause) ... FRESH ... (pause again) ... VEGGIES ... (um, I know it's vegetables, I just pressed the button!) ... 2 FOR ... (yet ANOTHER pause) ... FROZEN ... (darn, guess it must be 3) ... VEGGIES ... clear ... SELECT ... (oh no! where can frozen veggies be?!) ... etc.  At least the SELECT doesn't scroll when it appears, only when it's scrolling away.  But the worst part is seeing the VEGGIES on the display, alone, as I wait, knowing full well I pressed the veggies button.<br /><br />And I still have trouble figuring out which button is for the fan and which is for the light.  Making it worse is that there is one button for the light (HI/LO/OFF) and 2 buttons for the fan (ON/OFF and 4 speed).  Actually, there is another button each for some obscure settings we never use.  Sure, there are some tiny dark grey letters showing which set of button is which, but those are only visible up close in bright light.<br /><br />Gone are the easy 1-button 1 to 6 minute quick start buttons.  Now it takes 4 button presses to do the same thing, although at least there is still a button to add 30 seconds.  I could go on and on about the poor interface, but I think you get the idea.<br /><br />Next major issue: the stovetop light is way dimmer than the GE was.  Even though there are 2 places in the design for bulbs, and my GE had 2 halogen bulbs, this one has a SINGLE incandescent bulb - not bright at ALL.  This is huge, as we use our stovetop frequently and now it is always poorly lit.<br /><br />And a another biggie: when the timer finishes, it gives 4 short, quiet beeps, and stops.  No repeat, nothing more.  So unless you are right by it, it is pretty much worthless.  We can now only use our oven timer - so no more dual timers when we are cooking different things.  I can't even count how many things have overcooked or been ruined because of the lame timer.<br /><br />The look is also unattractive.  The lightbox hangs down below the lower front plastic panel, ensuring everyone knows how tacky this microwave is.  Even the display is an ugly old-fashioned blue 14-segment per digit 7-digit display.  Most calculators have better!  Actually, I kind of like the blue.  Everything else in my kitchen is amber, so it creates a nice contrast.<br /><br />Furthermore, it is noisy.  It frequently makes weird grinding-like noises from the bottom right (I think it is a fan or the microwave element) - if I tap it there it usually diminishes or goes away for a while.<br /><br />Finally, the front glass broke once when we were opening the door a couple of months after getting it.  Samsung did send out a repairman within 2 weeks and repaired it under warranty and it hasn't happened again in the many months since.<br /><br />Is there anything I like about this microwave?  Well, it works.  It has a turntable.  It has sensor cooking.  And it has dual grease-filters on either side of the bottom with a powerful exhaust fan (that has 4 levels when not using the microwave, 2 when in use).  It also has an easy-to-clean all-white interior.  And it was less expensive (on sale) than the similar GE units - but rightly so.<br /><br />PROS<br />It works.<br />Sensor cooking.<br />Dual grease filters.<br />Easily fits space replacing similar GE models.<br /><br />CONS<br />Horrible user interface.<br />Poor single-bulb incandescent stovetop lighting.<br />Loud, obnoxious noises.<br />Cheap looking.<br />Worthless kitchen timer.s amber, so it creates a nice contrast.<br /><br />Furthermore, it is noisy.  It frequently makes weird grinding-like noises from the bottom right (I think it is a fan or the microwave element) - if I tap it there it usually diminishes or goes away for a while.<br /><br />Finally, the front glass broke once when we were opening the door a couple of months after getting it.  Samsung did send out a repairman within 2 weeks and repaired it under warranty and it hasn't happened again in the many months since.<br /><br />Is there anything I like about this microwave?  Well, it works.  It has a turntable.  It has sensor cooking.  And it has dual grease-filters on either side of the bottom with a powerful exhaust fan (that has 4 levels when not using the microwave, 2 when in use).  It also has an easy-to-clean all-white interior.  And it was less expensive (on sale) than the similar GE units - but rightly so.<br /><br />PROS<br />It works.<br />Sensor cooking.<br />Dual grease filters.<br />Easily fits space replacing similar GE models.<br /><br />CONS<br />Horrible user interface.<br />Poor single-bulb incandescent stovetop lighting.<br />Loud, obnoxious noises.<br />Cheap looking.<br />Worthless kitchen timer.",7/21/2014
17681610,R29JKYSXTH4JNW,544821753,1,0,0,N,Add me to the list of the great disgruntled. Ours stopped working after a year and ...,"Add me to the list of the great disgruntled.  Ours stopped working after a year and 4 months. It heats food, but the turntable doesn't spin and you can't change  anything on the touch screen.  Stick the food in and it just hums. A fire waiting to happen.<br /><br />Wish I would have read reviews here before I bought it.  It was the pretty one the wife loved lol. People are being honest about this lemon.  I did buy a square trade warranty after reading these reviews. Lucky and square trade is being good about it.",7/17/2014
36385949,R1FW5QI364TAEX,544821753,2,0,0,N,Another dissatisfied owner,"Let me add to the list of unhappy customers. We have had this microwave for about 4 years. It first failed within the first year and was replaced by the manufacturer without any issues. They came to the house and installed a replacement. Earlier this year some of the buttons on the control panel ceased to operate. I obtained a replacement panel and it worked OK for another month. Then, it ceased to heat anything. I replaced a defective diode and it ran OK for a few more months. Then yesterday while it was running I heard a poof and it shut down (probably blew the internal fuse). It also emitted an odor of something electrical overheating.<br />This time I'm throwing in the towel and will not attempt a repair. The ID label indicates that it was manufactured June 2010. I would expect to get more than 4 years out of such an appliance.<br />When it worked to did an OK job, but no better than the $50 counter top unit I keep on hand for when the main unit fails.<br />This time around I've ordered an LG and hope for better service.",6/16/2014
47873086,R1JKC7B63KI65G,544821753,1,0,0,N,Absolutely the worst,"My microwave failed within 6 months of purchase.  It was fixed by a repair agency, who also told me that 'it is normal for them to completely fail and shut down.'  After the repair, it lasted only 2 months, before completely failing again.<br />Worst of all is Samsungs' customer service.  I couldn't imagine anything worse.  They (Samsung) have told me more times than I have fingers and toes, that they would call me back to make an appointment for service, but, after 3 weeks, I am still waiting for someone to call.  When I call in to Samsung, I am starting over each time (from scratch) even though they've given me a case number.  I'm tired of being told by their Indian representatives: &#34;I'm sorry for that!&#34;<br />Don't buy anything Samsung.",6/11/2014
36166814,R2D2ZXPI7AS6WN,544821753,1,0,0,N,This microwave blew up!,"About two weeks prior to this microwave blowing up, we had a problem with it NOT turning off. It would stop if we opened the door, but once we closed the door, it continued to run - nothing showed on the keypad that it was running. We turned off the breaker and left it that way for about 24 hours. When we turned back on the breaker, it seemed to work fine until yesterday. We turned on the fan for about 30 minutes and then turned it off. During the next 20 minutes the microwave turned on by itself and we heard a loud explosion. The microwave was still running! We opened the door and the glass had exploded inside. When we closed the door, the microwave continued to run. We had to turn the breaker off. If we had left our home, the house would have caught fire!!!! We will be contacting Samsung and if they don't provide us with another microwave, we will issue a complaint for this fire hazard.",6/5/2014
26891143,R1P47CKQY2R19Z,544821753,1,0,0,N,Same problem as everyone else,"I bought this microwave three years ago, so the warranty has long expired.  I now have the same problem as everyone else -- the keypad has a short and the microwave is now completely useless.  Have to buy an entirely new microwave, since the cost of repair meets or exceeds the cost of an entirely new microwave.  DO NOT BUY THIS MICROWAVE.",5/27/2014
52016149,RIQEJNP5PBFYN,544821753,1,2,2,N,DO NOT BUY A SAMSUNG MICROWAVE,Do not buy a Samsung Microwave.  Purchased smh1816w January 2013 and in December 2013 stopped working have had 6 service calls and as of April 29 2014 still not working.  A&E service has replaced all parts multiple times to try to correct problem however with no luck.  Samsung is unwilling to replace the unit or refund the money paid which would be preferred. I will never purchase a Samsung product again.,4/29/2014
28294786,R2KWFTBP5XCQVL,544821753,1,0,0,N,Expensive paper weight!,These reviews don't lie. Samsung makes large expensive paper weights. After 1 year and 10 months we too received the 5E or SE error code. Now that it is out of warranty it will be an expensive fix. Pure Garbage. Samsung has the worst customer service. Apparently the error code has to do with a faulty keypad. If you search the error code it says that the steam and heat cause corrosion on the connectors on the keypad board. It is meant to go above stove that creates steam. Samsung needs to make it right and they refuse too. Look at all the poor reviews for this appliance. Shame on Samsung. Never again and that includes all your products.,4/15/2014
30850605,R2EMEKKRRB4Y29,544821753,3,0,1,N,Venting to outside,"Why is it, when I am using the microwave I can't use the fan's highest speed. Only 1 and 2, when I press it again the fan's speed goes back to<br />#1. No problem with all speeds if not using the microwave at the same time.",4/5/2014
32272072,R199B273X5YFK4,544821753,1,0,0,N,SE error,Like everyone else our November 2010 purchase has come to be the bane of our kitchen. If you never boil anything on your stove your experience maybe different but if your family requires food to survive I'd opt for a different microwave.,3/15/2014
39441134,R23NQJCDDXOTOV,544821753,1,0,0,N,Broke after a year of normal use,"Very disappointed in this product. Completely stopped working after about a year. Everything went out on it, would not even power on.",3/10/2014
17866876,R22ZZ4XQICS6IG,544821753,1,1,1,N,Do not buy this microwave,"I am having the same issue but the keypad goes dark as soon as you press start so the error code does not come on. Samsung would not fix this. They want me to pay for a repairman to come out here to fix. After all of the reviews you would think they would want to fix and save their reputation. I will never buy Samsung again, as I had a Tv that also had issues that they knew about and would not fix. If I pay for a repairman I might as well get a new microwave for that price and it won't be a Samsung!!!!!!",2/16/2014
14546396,R3DVD9863AY0YN,544821753,2,0,0,N,major design flaw!!!!!!!!,"I love the microwave but their answer to how do you clean the glass door was, cover your food and you shouldn't have to clean it! I always cover my food yet sometimes the saran wrap breaks and things splatter! How you could put a fine grate between the food and the glass and expect food not to splatter is beyond me. Samsung  makes great tv's and electronics, but stay away from appliances as they obviously do not have a clue! In the meantime, I paid top dollar for what I thought was a great product. Little did I know I'm now stuck with something that makes me look like I'm a total slob in my kitchen. Thanks Samsung!",1/29/2014
15102471,R2GG7YYQBEXHZG,544821753,1,3,3,N,It went up in FLAMES!,"I bought this microwave a little over 2 years ago, and it was just okay. I really didn't like the way it functioned compared to previous microwaves I have owned. but it looked good, and worked fine; UNTIL YESTERDAY.<br /><br />Out of nowhere, it just went up in flames, it wasn't even in use at the time.<br /><br />The only one in the house was my 72 yr. old mother-in-law, she said she noticed earlier that morning, the display on the microwave was off and she was unable to use it (as if it was unplugged). A while later, the house filled with smoke. Smoke and  flames were shooting out of the top vent of the microwave. She said there was so much smoke she could not even see in the kitchen.  She called 911, the fire dept was dispatched, and she exited our home. By the time they arrived the fire had burned out on its own, and the damage was contained to the internals of the microwave. The fire crew removed the microwave from my home, and inspected the home to insure that the microwave was indeed the cause of the fire. Thankfully there was no damage to our home other than the microwave itself, and a strong odor of smoke and burnt plastic (I'm sure it will take weeks to get rid of the smell).<br /><br />I contacted Samsung, to report what happened and am awaiting a response from the Executive Customer Relations dept. do to the nature of the incident.<br /><br />I'm not really sure what I want from them, more than anything to create awareness. Maybe they will issue a recall, based on this and all of the negative reviews I have read here on Amazon. I would encourage others having problems with this model to report it to Samsung. It may not do you much good, but who knows, you could save a life or something.<br /><br />UPDATE 01/31/2014:<br />Samsung Executive Customer Relations department contacted me on 01/20/2014 (MLK Holiday), by telephone (cell phone). I was asked to provide the microwave serial number but did not have it with me, so we agreed that I would provide it via email. A short time later I received an email asking to provide the serial number as Samsung would like to locate a service center to diagnose the unit.  I responded later that day with the serial number.<br /><br />On 01/21/2014 I received a response which stated, based on the serial number provided, the microwave is out of warranty, but due to the nature of the problem Samsung will cover the cost of diagnostics, and a service center will contacting me.<br /><br />On 01/22/2014 I received a call from the service center informing me they received the service order from Samsung, but it states the microwave is out of warranty so I will be responsible for the payment, I asked them to double check with Samsung, but they said I would have to contact them. I sent an email explaining what the service center said, and a few hours later Samsung responded with a One time Accommodation for the labor which I assume was also sent to the service center.<br /><br />A few days later the service center contacted me again, explaining they received the accommodation from Samsung, and asked if I could deliver the microwave to them, which I agreed (they were only about 1 mile from my home).<br /><br />On 01/29/14 the service center contacted me to explain that several parts in the microwave short circuited, and required replacement.  They explained that the accommodation was for diagnostic labor only, and any further repair would be my responsibility.  They asked for direction; explaining that the parts required are expensive, and the repair would most likely exceed the cost of replacement.<br /><br />I sent another email to Samsung explaining the call from the service center.  I explained that I made it a point to buy appliances from well know major brands such as Samsung with the expectation of higher quality and long life.  I asked that given the fact the unit failed due to a short circuit, after such a short life, under normal residential use, that they consider replacing the microwave at no cost, despite the fact the warranty period had ended.  Not to mention it almost burned my house down.<br /><br />It has been over 48 hours sense the email was sent and I have not received a response from Samsung. I have instructed the service center to recycle the microwave if they do not hear otherwise from me (or Samsung) by Monday (today is Friday).<br /><br />If I get a response from Samsung, I will update the review.he microwave at no cost, despite the fact the warranty period had ended.  Not to mention it almost burned my house down.<br /><br />It has been over 48 hours sense the email was sent and I have not received a response from Samsung. I have instructed the service center to recycle the microwave if they do not hear otherwise from me (or Samsung) by Monday (today is Friday).<br /><br />If I get a response from Samsung, I will update the review.",1/17/2014
26476846,RPJI2KKQEPLV2,544821753,1,2,2,N,Caught popcorn on fire and Died,"Just bought house with this unit in the house.<br /><br />It looks good.  The controls are awkward, the timer and fast button controls are not intuitive.<br /><br />However, it worked fine, has light under it and fan that works ok.<br /><br />My wife cooks popcorn init and it flames up, my wife throws the now burning popcorn bag in the sink and we clean it up.  The unit fails to start at all.<br /><br />I have never had anything flame in a microwave, especially with no metal or tin-foil at all involved, and fear replacing with the same brand, so looking at other.<br /><br />I definately would steer clear of these units as they seem to have multiplel issues.",1/16/2014
52572059,R1WE2KIVVJGUA1,544821753,1,1,2,N,Will fail.,"I did not buy this microwave on Amazon, but felt compelled to add to the feedback as I buy many other products here using the customer reviews.  I bought this microwave 2 years and 2 weeks ago.  It completely failed last night.  It was running as normal, got very loud, then completely died.  I've reset breakers and checked that power is still being supplied.  Everything checks out.  Samsung wants $288 for the service contract to fix it, but as of this posting, that's how much a new microwave costs.  Do yourself a favor and avoid this microwave.",12/9/2013
