customer_id,review_id,product_parent,star_rating,helpful_votes,total_votes,vine,review_headline,review_body,review_date
51276712,R2U5A8P7ZZO75F,109226352,2,3,5,N,Junk! Do not buy!,We bought this microwave less than three years ago. It was handy and compact. It has now burned out in a spectacular and very dangerous flashing of fire and loud noises. Buy something else!,5/13/2015
25982682,REKMNME7NFLP7,109226352,4,1,1,N,... for about a year now and I am very happy with it,I've had this microwave for about a year now and I am very happy with it.  It fits in the corner of my kitchen counter and works just great for reheating foods and cooking vegetables.,5/11/2015
36658239,R3STZQPYKZJZX5,109226352,5,3,3,N,Best microwave I've ever owned or used.,"This is by far the best microwave I've ever owned, of any size or price, for two reasons: (1) form factor and (2) simplicity of controls. I use a microwave to heat leftovers, cook frozen meals, make popcorn, melt butter or cheese, thaw frozen meat, reheat cold coffee, freshen stale bread of make it into croutons, cook sausages and hot dogs etc. I use this microwave several times per day.  I think my microwave usage is pretty typical.  The only thing I don't do in the microwave is prepare entrees from scratch (like cooking a roast or casserole). I've cooked all sizes of frozen entrees with no issues. Note, my review refers to an earlier model of this machine, which seems identical to this one that has replaced it.<br /><br />(1) Form factor. Because the guts of the machine are under the cooking chamber, this has the smallest possible footprint.  And because of the rounded back, I have it tucked into a corner of the countertop. This means I lose only 1' of countertop, and furthermore it's an awkward part of the countertop I wouldn't use for prep work etc because my elbow would bang into the fridge. Every other microwave I've ever owned took up 2' of prime, useable countertop. This makes such a huge difference in the usability and appearance of the kitchen that I'd give it five stars for this reason alone.<br /><br />The interior size of this machine is bigger than you'd think because it's round and all the space is useable. The round turntable entirely fills the rounded shape of the interior. An advantage of this is that nothing falls off into the corners as it cooks. I've occasionally thawed something bigger then the turntable (the sides and front of the microwave are square so this is possible) and it wasn't a problem.<br /><br />(2) Controls. I love love love the simplicity of the controls. It does exactly everything I need it to do in a way that is completely intuitive and simple. I should mention I own an Emerson microwave in my office that I have never yet beenable to figure out how to operate (and I'm of at least normal intelligence). The hated Emerson has lots of buttons and I'm sure it does a lot of things I don't need, but none of that matters because I'm not willing to learn a complex and counterintuitive interface to cook a frozen lunch entree. This Whirlpool, however, is amazing.  It has Power, Defrost, Reheat and Popcorn buttons, as well as a Plus (+) and Minus (-) and a Start and a Stop. I accomplish everything with the Plus, Minus. Start and Stop, and occasionally Power.<br /><br />To operate, you can just press the Plus until you reach the time you want, then press Start. Bam. You can't get any easier than that. The time increments get larger as you increase time, and this is absolutely not a problem. It uses 5 second increments up to 2 minutes, then 15 second increments to 3 minutes, then 30 second increments up to six minutes, then one minute increments from there. This is fine; I've never had an issue where using 6 or 7 minutes instead of 6.5 minutes caused a meal to fail (my pot pies call for 6.5 minutes at 50% power, and they're fine at either 6 or 7.  When I make popcorn, I always listen to the popping and stop it when it slows. That's because popping times depend much more on the freshness and moisture content of the kernels than the power of the microwave; this is true of every microwave. Similarly, when I'm thawing something I pay attention to the progress of it because again, the fat content of the food and how hard it's frozen makes all the difference in timing. I suspect there are fancy convention microwaves with thermal probes that allow completely mindless use, but that kind of ultra high-end microwave isn't what I want or need.<br /><br />I've been using an earlier model of this microwave for three years with absolutely no problem. I can't speak to specific reliability of the model here, but mine is the same in layout of controls, form factor, etc, so I would not hesitate to buy this one. In factI'm very tempted to buy one of these for the office and get rid of that annoying Emerson once and for all.",12/14/2014
15476643,R1HUHZ4LPUFCKB,109226352,5,0,0,N,Love it!,"I have had mine for over a year and it is perfect! No one even notices it and it is using corner space I would not otherwise use. If trying to heat large amounts or use it a defroster or substitute oven then this might be too small for you. However, if you use a microwave for reheating food, cooking small amounts, popping popcorn and heating water it truly is perfect!",11/13/2014
19554274,R2D3DACG6K35HD,109226352,5,0,0,N,Compact and Cute,"Little and cute, and it does the job. I use microwaves mostly only for melting butter and chocolate, and for making popcorn. We had gotten rid of a big, old one, but my husband likes to have one for reheating food, so we succumbed. Opening the door with one hand is difficult or impossible, but the price and the size are right and thus, a good review.",9/20/2014
47031541,R2J74BFOF8DPY8,109226352,1,5,6,N,Does not operate on an inverter!!!,I bought this micro to go on my boat because of its compact size and can fit into a corner.  Even rebuilt my cabinet on the boat to accomodate it. Now I have found out it will not operate on an inverter,6/22/2014
33032266,R1MQZFT428M8KW,109226352,5,2,2,N,thoughtfully designed,"I bought this because the counter footprint and wattage were both low. I didn't expect very intuitive controls, a super easy-to-clean interior, weirdly efficient heating (stuff gets hot FAST) and thoughtful design touches like an interior light that switches off with disuse, and a polite, non-obnoxious &#34;your stuff is done&#34; beep that only goes off a few times before quieting down. It's a great little microwave. Bit tall, but that should be obvious from the pictures.  Update: Died in 2017 after years of faithful service, and I'm going to replace it with the same model. It has a totally unmatched capacity to footprint ratio, and I'm really annoyed that no one else is making microwaves that stack the mechanical bits under or over the food cavity. This is obviously the better way to build a microwave.",11/19/2013
14862626,R1JC5ODZ0ASZMS,109226352,1,12,14,N,DEAD after ony 1.5 yrs of light use,"Very disappointed, because this is the perfectly shaped microwave for our kitchen. But my husband reported a big, scary electrical storm (and bad smell = burning machine?) inside the unit yesterday, along with a weird dark brown spot on the inside of the machine. He was melting butter in a Pyrex bowl. Today, the microwave is headed for appliance recycling.<br /><br />Importantly, we only used the unit at most once or twice per day, to warm or melt things.",10/7/2013
13048864,R327DRKA5F5EQ8,109226352,5,1,1,N,Cutest and most space-saving MW ever,"My regular glasses can't fit in so keep that in mind, you'll need shorter glasses. Its footprint is a winner, even though I got tons of real estate on my countertop already, I still appreciate how much space it frees up when compared to my big ass conventional MW. I do miss the analog dial (to set minutes) on my old MW though, touching these touch-sensitive totally flat buttons is just so unnatural.  I regret that I didn't buy this earlier.",9/16/2013
45406057,RKNPXA0RWXMNN,109226352,1,14,15,N,Packed up,Has been owned for less than a year.. started sparking and had to stop using.  Now shopping for a new one.,2/11/2013
39140932,R3831T9HRDIFE4,242727854,3,1,1,N,Worked great until the door broke!!,"Bought this microwave in 2011 to replace a 30 year old Sharp Carousel that was given to us 20 years ago. The Sharp didn't heat evenly, but it lasted much longer than this one did. This GE microwave looks great and heats fast and evenly for the most part and I love the inverter defroster! But it is impossible to make good popcorn, no matter what settings I use it always ends up with lots of unpopped kernels and some of it burned. I wish the door closure was designed better. As with most modern day products, the plastic parts just don't hold up to everyday use. It currently only works if you slam the door hard. I have a feeling that its days are numbered and I won't be replacing it with another GE microwave!!",3/15/2015
34830339,R2JFLO1ADSRKI8,242727854,2,1,1,N,Worked great but now door won't close right so it doesn't work.,Worked great for a year or so and now the door won't close properly so have to get a new one.  I expected better quality out of a microwave this expensive.,2/28/2015
33313884,R3REJQGN2U5WOQ,242727854,1,1,1,N,"Before you hit purchase, be warned.","Warning: Stay away from this microwave.  It looks pretty, but it will cost you.  Read the other reviews about its unreliability, GE's poor service, and the expense of repairing this product.  I should have done that before we purchased ours.  If your product is still under the one-year warranty, maybe you have a shot at breaking even.  Ours stopped working just a few months after the 12-month warranty expired.  If you're not under warranty, this is an appliance nightmare, which begins with a $99 service charge so the GE authorized repairman can tell you how much it will actually cost you to repair the microwave (parts and labor).  Not sure how you can ever cost-justify repairing one of these.  Update: GE told us it was not cost effective to repair the unit, but they did offer a $200 rebate toward another GE microwave.  Still can't recommend the unit.",12/29/2014
42772012,R24211W83A7KND,242727854,1,4,7,N,Unreliable + Horrible Customer Service = No more GE products for me!,This review is as much for this product as is for Consumer Reports. Bought all new appliances for a new cabin we built and used Consumer Reports recommendation to buy these appliances. This was one these purchases and was given an excellent review by the Consumer Reports people!!!<br /><br />Lasted just over a year and quit working. GE wants $75 just to look at it before telling me how much in parts and labor they will charge me to repair it. I can buy another company's 2.2 Cu. Ft. Stainless Steel Countertop Microwave for $89 today brand new with full warranty! Ah...no thanks!<br /><br />My old 29 year old Panasonic is still working great and heats food just as well as this one if not better. I think I'll take my own advice now instead of Consumer Reports and buy another Panasonic!<br /><br />UPDATE: Found out the inverter board is bad...GE wants $250 for a new part + $75 service trip charge and another $75 for repair = $400 total repair cost for a microwave oven just over a year old when one of these brand new is just under $300!!!,2/14/2014
50053360,R1WVDDAMSF2LUC,242727854,1,2,3,N,Total JUNK!,Bought under 3 years ago.  First the door stopped closing fully unless you slammed it.  Now all it does is work for 5 seconds and then stops working.  Total JUNK!  Total waste of money.  Now I need to buy a new microwave...AGAIN!,10/24/2013
14784954,R2LICHXRAO7O41,242727854,1,4,5,N,Get a Commercial Grade Microwave,"Started making a buzzing / arcing sound this morning.  Opened door, smelled burning electronics, unplugged for 30 minutes, tried again with nothing inside, same result.  Dead, going to recycling.  Getting a Panasonic Commercial Grade microwave instead - all residential microwaves seem to have reliability issues.",6/16/2013
53042200,R3SLHIN4AAJQN2,242727854,1,2,3,N,Just a pretty face!,"Man I wish I'd read these reviews before buying this. I was at a local Big Box store and saw this on the shelf, decided to buy it on impulse.  After all, it's a GE and that's a great brand, right?<br />It was disappointing from the start. I don't use a microwave for much other that popcorn and heating freezer meals, and it couldn't even handle those. The popcorn setting burned the popcorn (my old, cheapo Sharp would always stop at just the right time.)  The meals were heated unevenly.<br />And now, after less than a month of very light use, the display flickers and it refuses to turn on.<br />After reading these reviews I decided it wasn't even worth repairing. I've junked it and bought a highly rated Panasonic from Amazon (along with a 3-year Square Trade warranty).<br />What a piece of junk!",2/12/2013
50181141,R2ZUTLNNXFQ8C,242727854,4,9,12,N,Great customer service while under warranty,"Warning:  For appliances, Amazon.com reviews are skewed to the low side.  Most people who write appliance reviews do so because their apppliance stopped working and they get mad and want to take it out on the company.<br /><br />The Problem:  most microwaves are made by a few Asian companies.  GE has stopped manufacturing most small appliances and even some major appliances.  Many of the GE refridgerators are not only made in Korea, they were designed and engineered by Korea and only have a GE label slapped on them.  The expensive GE Profile microwaves are made by the guys who make the Panasonic and other microwaves.<br /><br />With an appliance or piece of electronics, it can be the luck of the draw.  There is a basic reliablity curve, called the bathtup curve. In the first few months of a product's life, there is a high percentage of units that fail.  Then, if you get past that, there is a long period where the odds of your product failing is very low, until end of life is reached, maybe 10 to 20 years later.  The people who write reviews in Amazon are the unfortunate ones who products fail during that initial period.<br /><br />My microwave broke after 4 months.  But, GE customer service is great.  I called them up.  They came to my house the same day.  It needed parts the repair did not have on his truck.  He ordered the parts, which came 2 days later.  I made another appointment and my microwave was back in a week.<br /><br />This microwave is big inside.  I don't know how imporantant that is.  We can put big plates or platters in it.  But, if it wasn't so big, I could just put the food in smaller bowl.<br /><br />It has lots of heating options.  But, so do the cheapest microwaves.  Personally, I don't think any of those heating options are of any value.  It is not like they are reliable to work automatically.  With any microwave, you experiment a couple of times and then you konw what setting to use.<br /><br />Really, there are only 3 important features for amicrowave:<br /><br />1.  How it looks.  I think this looks great.<br /><br />2.  Power.  This is 1200 watts and heats food fast.  I wouldn't get anything under 1000 watts.<br /><br />3.  Quality.  Unfortunately, I don't think you can do much about this.",4/29/2012
47604399,R1G2MVCWGM2F8W,242727854,1,6,6,N,a lemon,"[[ASIN:B000UW1WW8 GE Profile : JES2251SJ 2.2 cu. ft. Countertop Microwave with Child Lockout and Extra Large<br />Capacity<br />I purchased this product less than two years ago & today it finally just stopped.This was considered a very good micro, however it should have lasted much longer. I no longer have any faith in GE products and would never recomend this product to anyone!",3/21/2012
15556933,R3DTAGSZ8HL6XM,242727854,1,5,5,N,Failure at 16 months,"Our JES2251SJ02 lasted 4 months past the 12 month warranty. The inverter blew and the cost for a replacement inverter was $225, a new JES2251SJ02 is $258 so were trashing it. GE is sending us a $100 credit check good only for another GE appliance. The repair man recommended buying the cheapest microwave available and getting the extended warranty on any appliance. Everything out there is trash, said he. I'm afraid he is right.",2/29/2012
15281335,R1TCIRB69JDSSB,242727854,1,1,3,N,Terrible! Unreliable and now is DEAD!,"This machine's finish quality was off out of the box.  The door didn't quite line up with it's case when closed and there were a couple small dents on the lower left of the door as well.    These were tolerable, however, as long as the machine worked - and it did... sometimes.    For example, from the start this machine would occasionally shut off mid-cooking, as in the timer would go blank, the light would go out, and the food would still be pretty cold.      Other times the food would seem to be heating up pretty well but then the machine would shut off.  On those occasions we thought it might have quit because it was getting too much steam on its sensors (wherever they might have been) so we would wrap foods extremely tightly with plastic wrap - still to no avail.      On still other occasions the food **looked** like it was being cooked (light stayed on, the table rotated, the timer counted down, and tone sounded at the end) but then it would turn out to be only ever so slightly warmer than when originally put in.    After a year of our just making do with this machine's cranky behavior and then just planning our meals without microwave use it died altogether.    My wife and I can only say, Good riddance! in response.    Consumer Reports lists this microwave as a best buy and, honestly, that's why I bought it in the first place.  Unfortunately, this machine is far, far, far from being a good buy much less a Best Buy!!!  Based on my experience and those of the others who wrote in here I won't be touching a GE microwave for years, if then.",5/25/2011
45020519,R9S6HGRRCO1QK,242727854,1,2,6,N,Would never purchase anything by GE again,"We purchased a new house which led us to purchase a new microwave and refrigerator.  We chose GE for both.  After six months the ice maker stopped working.  After 6 years, a refrigerator which still looks brand new, was freezing all of the food in the refrigerator section.  Next came the refrigerator section not cooling at all.  We had to go purchase yet another refrigerator as we couldn't deal with our food going back all the time based on the reliability of this refrigerator.  Moved this GE refrigerator down the basement to use for excess drinks, etc. during the holidays.  Repair man just left after telling me it was too expensive to fix and he would not guarantee that something else didn't go wrong.  Oh yeah, forgot to mention, my GE microwave broke last week also.  After reading the reviews/complaints on GE appliances, I will never ever put a GE appliance in my house.  Spread the word.....",2/9/2011
52937365,R1UST0H9LWH9HJ,242727854,2,5,8,N,Plan to replace in 2-3 years,"Having had an Amana Radar range for the usual 25 years, I was forced to replace it when it finally failed.  (I had even dropped it on its end, my mother ran it empty, etc., and it just kept going.)  I replaced it with this unit which I used for coffee, leftovers, and maybe popcorn heat ups; nothing like the actual cooking I did with the old unit with its regular and candy temperature probes, etc.  Between 2-3 years old it just crackled and popped and limped along for a day or two with a hard reset.  Dead.  The popcorn setting never worked (other microwaves I have used elsewhere did a great job) nor was the sensing mechanism impressive.  I also didn't like you couldn't use the timer independently when it was running.  Sure, it may be the magnetron but you have to pay to diagnose then replace.  Although it is still top rated on Consumer Reports, read the users' reviews to get the true story.",8/26/2010
35743153,R3SJB3YH4OKDNR,242727854,1,3,5,N,GE Spacemaker microwave oven,"I purchased a GE Profile Spacemaker 2.0 oven model #JVM2070 BHO2 in 2007. About a year later the handle came off in my hand. I did my own repair but in so doing found the quality of construction to be quite poor. Self threaded screws in inferior quality plastic was the problem. Now, the keypad will not accept any inputs. GE only sells a control assembly at nearly $400 (the oven originally cost about $500). GE says their ovens are not consumer repairable and refer customers to a repair facility. My options are to pay a GE technician $75.00 to tell me the control assembly must be replaced at a cost of $400 or buy another brand of oven with a longer service life. Which option do you think I will choose?",4/28/2010
15116632,R2VXOQOAHZUJTW,242727854,1,4,6,N,Buyer Beware of GE!,"PLEASE read the reviews, it could save you time, money and frustration.  I also bought a GE Microwave - Cafe thought it would be a quality product because I paid over $400.00, it also started dying after the first year, the magnatron, which has a five-year warrenty was corroded and had to be replaced at an additional $$ repair cost, part was free.  One day after the 30 day repair warrenty the microwave  totally died -$800 +.  Repair failed to come during appointed time, in fairness they later said they had called and rescheduled, but I had no message on my phone so I waited for 4 hours.  The manager I spoke to was willing to have me wait another five hours on another day, that's the best they could do.  So if you want to throw your money away and get poor service, definitely buy GE products!",3/20/2010
52952311,R13B85G4EK2M2R,242727854,3,13,16,N,Good microwave but GE must think it's a disposable.,"We bought this microwave (JES2251SJ02) in Jan. of '07. It works pretty well. I like the Inverter defrost capabilities. Recently (Dec. '09) the oven bulb (part# WB36X10302) burnt out. Not a critical problem but a definite pain in the a**. So far my choices in fixing it are:    1) Open it up and poke around trying to fix it myself. Carefully! There's reported to be high voltage capacitors in there that can permanently ruin your day and all your days to come. There is apparently no manual available that will tell you how do do this or what to watch out for.    2) pay for a GE technician to come to the house ($69) and replace the bulb ($12-$20 I think, the GE appointment scheduler doesn't know but I found it online for $11.75) PLUS LABOR.   How much do GE techs charge per hour? GE maint. doesn't know or won't say. How long will it take to complete the job? GE maint. doesn't know or won't say.   Let's estimate that the labor involved takes half an hour to pull the cover off and dismantle the thing enough to get to the bulb and replace it. If the tech charges only $50/hr (probably considerably more) that's a total of $106 (house call + parts + labor). I paid $233 for the thing new. I need to pay almost half the purchase price to fix a burned out bulb 2 yrs later? Time to think about not buying anymore GE appliances.",12/7/2009
51388646,R10R74VVFR2Z4U,242727854,2,19,25,N,Poor Product; Worse Customer Service,"I should have listened to my wife.    I'm about to arrange to take my third Monday afternoon in a row off from work so I can be here for GE's service technician. He's repairing my microwave, which is less than 6 weeks old.     Here's what happened.    Week 1, I call the service center, describe the problem I'm having (power cuts off after a few seconds) and the rep says it's probably an inverter board, and schedules a repair call.    Week 2, The technician arrives, diagnoses the problem and says it's an inverter board. He orders the part.    Week 3,The part has arrived, the repair guy comes to install it, but it's the wrong part. He has to order the right part, I have to take a third day off from work to be available,  and we have to go another week without a microwave.    Wouldn't the RIGHT thing for GE to have done is replace the microwave? Just ship us a new one, and have us ship the old one back? Or have the repair guy make the swap?     That would be showing GE cares about their customer's time, they're concerned if they waste time because of their error, and keeping customers satisfied is its top priority. Instead, GE parrots back the warranty (we only have to repair the appliance, not replace it) and disregards what this experience has meant to its customer and his perception of their company.",7/21/2008
40721534,R1ISQFXX70Y0OH,242727854,1,87,94,N,Poor reliability,"I am very disappointed at the poor reliability of this unit.  Ours is less than a year old and has failed--now, when attempting to cook, the unit shuts off before the end of the programmed time.  Even though the light comes on and the turntable turns, the unit does not heat food.  Like others, I purchased this unit based on the recommendation in Consumer Reports; this recommendation didn't pan out.  I tried to schedule warranty service and GE is making us wait a week to schedule and their frustrating telephone system does not provide information on where I can take it for service for faster turnaround (and didn't put me in touch with a live representative).    When the microwave oven worked, it worked fine.  We replaced a Sharp unit with this one; though this unit has the advantage of a larger capacity, its controls are less intuitive.    Based on poor reliability and poor service, we're certainly not going to buy another GE microwave.  We've had good success with GE refrigerators in the past; this is very disappointing.  A quick search on the web now reveals that GE microwave ovens are not reliable--many others appear to have similar problems with the magnetrons.    Perhaps this is one reason why GE is looking to sell its appliance business...",5/27/2008
