customer_id,review_id,product_parent,star_rating,helpful_votes,total_votes,vine,review_headline,review_body,review_date
23745233,RZV2OHYHB78PT,618770050,3,2,3,N,Be careful on installation. Some SS Steel parts magnetic.,"I just installed this item. Be careful with the lag screws provided. They are tin like and do strip out no matter what and cannot be loosened or tightened once the head strips. They require a special flat nose phillips head but that did not help. Buy some quality mounting screws as $ 500.00+ is not enough for GE to include those, and I hope the rest of the unit is not as cheap as the mounting screws. Pollute the planet and make a extra trip to the hardware store. Second, I was leveling the microwave and son of a gun, the magnet on my level stuck to the inside of the unit, which is supposed to be stainless steel. I would still prefer whatever this stuff is to the plastic interior that comes with non-convection. The templates were perfect and put all the screws in the correct locations. You need to order the charcoal filter if you are using the recirculate rather than outside vented feature. To recirculate, you must unscrew 3 screws on top rear and rotate the fan housing 90 degrees before you install the unit. You also need to remove 2 screws on the upper front trim and slide in the filter then replace the trim. My 15 year old did both. You need to butt the top of the unit to the shelf above, or insert trim pieces around the top. If you don't, and let it hang even 1/2 inch, the unit can rise up if hit and fall off the shallow rear flanges that hold it to the back wall bracket and fall onto the new matching GE range. Our cabinets had a wierd from the 1960's lip on one side (I like old school stuff) and I needed to add the trim to prevent falling. The unit powered on and worked once we finished. Will update after a few months of use. I am a licensed electrical and general contractor, so I hope this helps in getting it ready to install. Took my son and I about an hour. The unit looks great in the kitchen. After months of research, it was between this and the Sharp, but this had more power and capacity, and there was not a Sharp in any showroom for QC comparison. Hope itwas the correct choice.",3/19/2013
46832227,R2WJX6QPZ6FK6W,618770050,1,2,4,N,GE PVM1790SR1SS,None available.,3/3/2013
27964836,R2GMLIROXE3WZU,618770050,4,2,3,N,GE Profile --4 stars for now looks only!,"We purchased ours from a local store in on order to have it installed. They DON'T install the charcoal filter! GRrrr.... The reason I was so disappointed is because I'd read it was a bugger to install, as it was the wrong size. I was appalled to be told that they never install the filters, even if purchased from that store (bought mine on Amazon for $30 cheaper than the chain!). Was told I have to take the front panel off!!  IF the directions are followed carefully, it's very simple. It is designed to tilt, not stand straight inside the vent opening, as one would think. I tell YOU all this to say, laugh at the installation guys, get a screwdriver, and tilt the filter in, and pat yourself on the back. Who needs them anyway? Oh, yeah...to lift and drill and screw the thing in. It's heavy! Now, as for performance, more to come later!<br /><br />One last thing, all the reading I did on this led me to believe the vent was a powered door that opened, and that is a part that often breaks on OTR microwaves. This does NOT have a powered vent door, it just recirculates. That was the only reason I purchased a warranty. Oh well, now YOU know!",11/13/2012
43721040,R2YWU47I6SMF15,618770050,1,7,12,N,lifetime less than 6 years,"Bought GE's 2006 model. It became a bread box/clock four days ago (about 9/15/2012). Scheduled one of their authorized repair men. Took him 5 minutes to determine that the only problem was that the microwave generator thingy quit. The display, oven light and turntable are as good as new, but the micro doesn't heat anything. Cost of the part = $400. The good news is that the $75 house call will be offset by getting a coupon redeemable for $100 if I buy another GE Profile over-the-range. My cheap, little, off brand counter top microwave just won't quit working. I'm not certain what to do.<br /><br />One last thing, the halogen surface light quit about six weeks after original purchase. You have to stand on your head, and use a special backhanded screw driver to replace the bulbs. Very convenient feature, but maybe I should have paid an authorized repair tech to replace the bulbs.",9/19/2012
35060172,R1K7Z7LUEYYUR0,618770050,1,5,14,N,Total junk if this is like the PVM1870,"If this GE Profile Microwave is built like its cousin, the PVM1870, beware of the worst quality control and internal components possible.  In the two years we have owned a PVM1870 Profile, it has had 6 service calls and about every electronic part but the magnetron has been replaced, several components have been replaced TWICE.  I can accept and understand an electronic component failing, but not that many with some replaced twice -- does NOT speak well of either quality internal components, quality internal engineering or quality control.  The only reason that I gave it one star is that a zero star rating is not possible.<br /><br />Addendum:<br />The motor/power supply burned up AGAIN -- plus another service call for the vent door not opening any longer.  Now we are up to 8 service calls on the extended warranty.  This GE product is an ABSOLUTE PIECE OF JUNK and the last GE product we will ever own.  BTW -- the service personnel are excellent and know their jobs -- it is strictly the lack of build quality and quality control for this GE product that has caused so many failures.  It does not deserve ANY stars in the rating.",8/1/2012
51720674,R1IXI53QMLLDTN,618770050,3,38,44,N,Oven:  Good.  Installation: Problematic.,"I had an older GE microwave above my range that died after about 8 years. When looking for a replacement I decided to go for another similar GE in order to swap it out easily, figuring it would use similar hardware. That was my first mistake.<br /><br />There's a steel plate used to mount the oven on the wall plus three big screws that go in from the cabinet on top. Not only is the plate different (requiring removal of old & installation of the new), not only are the anchor points in different places (requiring new holes), but they're placed just marginally off the old anchor points. Meaning that the integrity of the wood where you need to drill is compromised from the old screw holes. It required me to install a whole new shelf in the upper cabinet as well as trying my best to fill the old stud holes with wood filler and hoping it would be strong enough when I re-drilled.<br /><br />Here's the kicker... the installation hardware comes with butterfly screws as well as two thick wood screws for mounting to the wall studs. Unfortunately, those two wood screws are made of very cheap & weak metal. I pre-drilled guide holes as per the instructions, but when it came to screwing the screws in- the heads twisted right off on both of them (and I was extra careful with the second one after the first one broke).  The screws were already 3/4 of the way in, leaving me with no way to remove them and blocking the ability to try again in the same spot (a spot required for proper installation).  The oven isn't light, the installation requires heavy duty hardware, why ship the microwave with such crappy screws?<br /><br />Lessons:<br /><br />Buy your own mounting hardware.<br />When it comes to buying a replacement appliance, there's no value in nepotism.",6/18/2012
34549900,R2VIW68E4UY1P4,618770050,1,12,16,N,Good for the first 2 years - broken after that - poor quality,"Worked great for the first 2 years than completely broken.  AFter charging me $99 to look at my microwave, the GE repairman indicated that the repair would cost over $400.  Wow - what a ripoff.  I expected a profile to last a little longer than that.  If you want to replace this in 2 years - go ahead and buy.  Otherwise, look for a brand other than GE.",5/6/2012
13140214,R1338K8UYV8HZ1,690479711,2,0,0,N,Died!,Worked pretty well for a couple of years and then just made a popping noise and died. I guess I'll just buy cheaper ones from now on!,9/28/2014
14329605,RA7XKFQRPN13R,690479711,5,0,0,N,A Great Microwave,I have owned this Microwave for 2 years and have NEVER had a problem with it.I use it daily for cooking and warming food. I would buy this same unit again. It works great.I don't understand all the bad reviews?This Sharp was a good product.I don't understand where people say it has a loud noise while it runs? I have had a few different microwaves and the motor sounds alike on every unit I had.My sharp sits on my counter near the stove and it has a really nice appearence to it.I am very Happy with this Sharp Microwave.,5/11/2013
50165965,R3C2TYCHFD7HZM,690479711,5,1,1,N,Masterful,"Had this for about 5 years now after a Panasonic NN-H965WF failed within 19 months of being purchased new. No repairs necessary with this Sharp microwave, and the sensor still works great. Use that function and you'll almost never have to worry about underheated food.",2/20/2013
50844124,R2KQAPISRV984G,690479711,2,2,3,N,Great for a couple years,"Loved this microwave when it worked...<br />I never had a problem with its cooking functions, lived/swore by the sensor reheat, and did what it was supposed to.  The problem I encountered was that after owning it for about a year and a half, it suddenly stopped working.  I'd set the time and hit start, the light inside would come on, the clock would count down, but neither the turntable would turn nor would the microwave actually start cooking.<br />I drove it to a Sharp certified technician, and about $65 later, it worked fine.  At least, for another year or so.  Repeated the process, paid another $65, and then it worked fine. This time, for another year.  Thanks to the economy, my Sharp certified technician lost his business, and now I had to drive it over an hour away if I wanted it fixed.<br />I brought it to a Sears service center, where they fixed it for about $50, and they said there was a problem with some kind of safety latch with the door.  This time, it lasted about 6 months.  I agree with other users, that every microwave on the market has some kind of issue.  It's time to accept the fact that we want these machines to do more than they could 15 years ago, and either the craftsmanship isn't there, or our appliances simply can't handle the demands anymore.  I guess 5 years is a decent lifetime now, sadly.",11/24/2012
17819306,R25WD5Q1Z0R5DD,690479711,3,3,4,N,Does this run on diesel?,"Just purchased this microwave and it is so loud that it seems like there is a semi tractor trailer idling in my kitchen. We could neither hear the television nor have a normal-volumed conversation with it on.  Everything else on the unit seemed great, but won't get to explore them as we will be returning it.",4/16/2012
52246958,R35P21ZFQGHKUK,690479711,2,4,5,N,Dies after 3 years,"Always had Sharp microwaves - the first one lasted about 10 years, this model lasted 3 and died today. The lights are on, the timer goes down but no turntable, no fan, just doesnt work.<br />I know they wont last forever but 3 years is a bit too less.",3/31/2012
52885594,R8YS6R7WNEVUL,690479711,5,3,4,N,A good product that looks good,"We are very pleased with the Sharp Microwave.  It works very well,  has easy to follow directions and looks great.",10/9/2008
33319288,R3TSAPM4UO3XJC,690479711,1,11,19,N,Dangerous,"I feel that there is a design flaw in this product. The SENSOR REHEAT button it just below the STOP CLEAR button and very easy to push by mistake. This very thing happened to our Microwave oven on January 27 2008, after a few minutes we could smell burning plastic, I ran into the kitchen and found the microwave smoking and after unplugging the unit I found that the door seal had a melted hole in it. I feel that an automatic feature like SENSOR REHEAT should not be an AUTO DESTRUCT! This could have become a very serious situation by starting a fire or having melted plastic stick to someone. I did not have the original receipt because it was a gift in 2007 and it is not worth paying the shipping charge to send it back, I wanted to inform you of this dangerous condition. We have replaced the microwave with another Sharp R402JK without the SENSOR cook, we have always liked sharp products and it is sad that this unit failed to live up to the Sharp reputation From Sharp Minds come Sharp Products  Sharp refused to honor the warranty saying that it was a consumer fault  by running the microwave with nothing in it. I feel this is a very dangerous flaw, you can just lean against the control panel and the unit will start up and run untill it melts.",2/24/2008
13043105,R2LC3SD0GB69EE,690479711,5,7,9,N,Great Microwave,We purchased this itme for a family member for Christmas. They love it. Said its the best microwave they ever had. They love the one touch features as well as the large cooking area. Would recommend if you want a dependable and spacious microwave.,12/31/2007
52659993,R2WIEATIDIXM84,690479711,5,6,7,N,Best microwave oven we've ever had!,"Earlier Sharp microwaves have been great, but this model beats the others we've had in features and speed--and this newer model cost a lot less. We haven't yet used all the features this microwave affords, but  we know we're going to be saving a lot of cooking time",8/13/2007
52607566,R3PXXLXNMOEUMF,692404913,4,1,3,N,"A very nice unit, but not much power","This is a very slick-looking unit, but unfortunately it doesn't heat things up fast enough, probably because it's 950 watts instead of 1100 like many others. The grill feature is a nice addition, allowing you to cook items you normally wouldn't cook  in a microwave.  Cosmetically it's a treat to look at, different than all the others out there.  You CAN see the food inside while it's cooking, but because of the black interior it's not as easy to see as others.  The front is all plastic -- stainless it's not.  The controls are nice, the push button opener is easy, the unit is relatively quiet while cooking, and overall we're quite pleased with it.  However, if you like to nuke your food in the shortest time, you should look elsewhere.",4/18/2015
52295219,RW3IPSERDKH3S,692404913,1,3,6,N,Fire Hazard?,I've only had it for around 2 months and it's starting to automatically come on when I close the door. The stop button doesn't turn it off. I have to open it and close the door until it shuts off or it automatically turns off.,2/26/2015
51084117,R2DTIT2XOPU48M,692404913,4,3,5,Y,rather large for a countertop but otherwise a good product,"The Samsung Counter Top Grill Microwave contains a lot of features including a soften/melt setting and a grill capability but is probably too large for most countertops, an obvious drawback considering what it is advertised to be for. However, after using this microwave I can say that it works well and, while some its components are plastic, it seems pretty well constructed to me. The grilling feature, (the microwave includes a grill and a setting for accomplishing grilling and the soften/melt feature are nice. I tried the soften/melt feature, for example, and it worked fine. I also think this microwave is attractive so that is not a problem. The only real problem I can see with this microwave is that it is just too large for most countertops. If this is not a problem for you then I recommend this microwave, otherwise, I recommend looking for a smaller microwave.",2/3/2015
21012418,R3U160NGKTVW49,692404913,5,4,4,Y,Really nice microwave that also grills and functions like an oven,"My husband has been using this for the past month in his high school classroom, and his students have been using it every day to warm things up.  It's already been getting a lot of use, and is holding up great so far. Of course, I know it hasn't been used that long, so I'll be sure to update my review as they use it more.<br /><br />The nicest features of this are:<br /><br />* It's a microwave that also grills and crisps food -- so it really functions more like an oven than a microwave.  It comes with a grill rack, and you can cook meat on it.  When you use the grill function, you can put metal into the microwave . . . but just be careful that you take out the metal once you use it as a microwave proper. The gill function works fine, but doesn't make your food quite as crispy and nice as a regular toaster oven does.<br /><br />*  The crispy plate is also perfect for doing pizzas, and the students who have been using it to cook frozen pizzas have said that they are evenly cooked.<br /><br />* The 1,000 watts make this pretty powerful.  It's good at evenly cooking food, and doesn't leave those cold places in frozen dinners like cheaper microwaves do.<br /><br />*  There are ten power levels and a plus 30 seconds button, so you can easily add more time to your cooking time.<br /><br />* A standard variety of pre-set buttons make this good for doing basics such as popcorn, veggies, and potatoes.<br /><br />* The exterior has a scratch-resistant coating, and the stainless steel facing doesn't pick up smudges and fingerprints like stainless steel often does.<br /><br />The measurements on the 1.1 cubic foot microwave are: 11-11/16 H by 20-3/8 W by 15-13/16 D in inches.<br /><br />Overall, this is a really nice microwave.  As I mentioned at the start of my review, I will update this as my husband and his students use this more, but, so far, they've really liked it and it's held up well to constant use.",2/2/2015
11969490,R8Z5VK8T7746S,692404913,5,2,2,Y,Presets are a bit off but it is pretty convenient to have,"this is a fabulous microwave. It does both jobs of a regular microwave and a toaster oven. What more could you ask for. Presets are a bit off but it is pretty convenient to have. You can grill in this as well, though I haven't tried it yet.. I'll keep you posted. I would recommend this product to others.",1/30/2015
52811948,R1C5GDOVP36K2Q,692404913,3,3,9,Y,It's Big,"The first thing you should know about this microwave is that it is big,so make sure you have adequate counter space to accommodate it. I only use it for simple things like heating things up quicky. For this it works well. I haven't yet tried its grilling feature.",1/28/2015
35815587,R3QVPNZ7G9X744,692404913,4,5,5,Y,"A microwave for those who want to cook more than just popcorn, TV Dinners and quesadillas","Samsung Countertop Microwave, 1.1 Cubic Feet, Stainless Steel is a must buy for people who enjoy cooking meals in their microwaves instead of just zapping snacks and melting cheese.  The counter top microwave is larger than most models and this one can cook main course meals and side dishes for you and your family.  A medium sized pizza can be cooked inside it's designed to &#34;crisp&#34; instead of being kind of on the soft side like other microwaves.  Just press the easy-to-use preset buttons for all of your cooking needs and if you want to &#34;grill&#34; your food with the grill layer that works similar to the one found in a convection oven but don't expect the same results.<br /><br />Overall, I have to recommend this microwave for those who prefer to cook their meals the fast and easy way instead of using a cumbersome stove or for apartment dwellers.  You can't go wrong with a Samsung Countertop Microwave, 1.1 Cubic Feet, Stainless Steel, especially if the price is right.",1/28/2015
18941326,R25NSG24NM4TLD,692404913,4,6,8,Y,Do you really need to grill in your microwave?,"This is a powerful and great looking counter top microwave. It's replaced my old 1000 watt sanyo. It has some features you don't find on many microwaves including a power saving mode (which turns off the LED clock), a grilling element on the top, and ceramic plate. In theory you could cook a pizza, heat up some bacon all while retaining the crispiness. I'd probably heat up frozen egg rolls before i do the any of the prior though. The grilling feature is gimmicky to me. First you lose height for reheating taller items. And I'm not one for having an issue using the oven for a frozen pizza or a pan for your bacon. Maybe even a toaster oven if you wanna reheat those chicken mcnuggets. There's also one more minor issue. The rotating glass plate is raised a bit too high around the edges than i'm used to. So make sure you lift your item high enough to clear the glass plate when taking anything out.",1/27/2015
