customer_id,review_id,product_parent,star_rating,helpful_votes,total_votes,vine,review_headline,review_body,review_date
12353377,R1X53E4WYB0D8O,459626087,4,6,8,N,Over the Range Sharp Convection/Microwave oven,I love it.  The only problem is the popcorn button is not set long enough to complete popping the popcorn.  It is only half cooked.  The convection works great and much simpler than my previous combination Convection/Microwave oven,10/9/2005
24377910,R2HOLVPM9L6UAW,459626087,5,5,5,N,"Top Notch Price, Delivery, Quality!","I was a bit put-off by other reviews critical of packaging, delivery, installation problems, and quality.  In my case at least, Amazon and Sharp scored 100% in all categories.  I do find that a small hydraulic jack helps immeasurably when single-handedly positioning the unit during installation. And the manual was misleading regarding exhaust fan orientation.  It's often the case that manual updates lag product improvements.",7/27/2005
29086099,R2FSVAV7HIG3MD,459626087,5,9,13,N,Shipping of this unit,I see many disgruntled people who have had shipping problems. Sharp  does not put enough packing materials in the box to ship these VIA Post-Office or UPS. At 85 lbs The seller needs to Double Box these and add more packing material and then send via FED-EX or DHL at a higher ground rate and customer will be fine. Thanks <br />thecloseoutking,11/19/2004
16444992,R2CABGE0AOSYQ8,459626087,1,12,16,N,Sharp..NO customer service!,"I ordered one of these on line. It came in promptly. I found that it was bent on the bottom, bent on a piece of stainless steel across the front and the vent damper that came inside the oven was damaged. This appeared to be a factory sealed unit. <br />It had to come from the factory like this. Possible the bottom was bent somewhere in shipment ranging from the factory to the shipper. Since I got it on Friday, I went ahead an installed it thinking that Sharp would simply send me the parts as they were screw on simple replacement parts. I was wrong. First Sharp said they did not warrant cosmetic damage. I told them it was factory shipped that way, please send parts. They said NO! Ship it back to who I bought it from. I, after much argument, had to take it down and send it back. This ended up costing the seller shipping charges which they paid. I felt this was not right as Sharp could have easily fixed the problem. The shipper did not have another unit in stock, so I got a refund and ended up buying another brand locally. The foam in bottom of carton was very thin (none in middle), thus, subjecting the unit to shipping damage. I had a Sharp before this one that never gave any real problems, but their customer service really sucks!  <br /> <br />My advise to you is to carefully check ANY microwave oven you buy before you leave the store or install it. Apparently the factories in USA or Korea do not do this before they ship them. <br />I finally got my replacement oven installed, but it was the third unit to get one that was not bent right out of the box.",9/30/2004
49010899,R2OXHMMI830KJ3,459626087,2,12,14,N,"A great, sleek oven... if you can get an undamaged one.","We ordered one of these and were shipped an open box/customer return. The bottom of the unit was dented and the interior was dented. It made a humming/vibrating noise during microwave operations. <br />Amazon shipped us another unit which also was an obvious open box/damaged customer return. Looks like people are dropping these during the install, then returning and the factory/warehouse people aren't even refurbishing them.  It was easy to tell it was already used since the exhaust vent was not set to the factory default of recirculating.  <br />It isn't Amazon's fault, in fact they were so quick to ship another unit(2nd day fedex!).  I wonder if other vendors are seeing this problem...  I love the way this looks over my stove, but it looks like they wont be sending another one due to the problems with the warehouse.",9/13/2004
52989643,R3D7L40T8FAR3R,459626087,5,122,135,N,American Made Microwave w/convection -works great,"I purchased this item for two reasons, 1) because this is a Union Made microwave assembled in TN (the only American made microwave I've found)  and 2) It has a convection oven that can double as a 2nd oven.<br />The styling on this unit is very nice, sleek and not overcomplicated, it enhances the look of my kitchen.<br />The microwave cooking is simple, with built in functions for thawing frozen items or popping popcorn, etc.  You punch a button, it asks you how many steaks you are defrosting or how much popcorn you are popping and it does the rest.<br />Convection cooking is new to me, but the manual and recipe booklet that come with the unit have already produced salmon steaks with a white wine/basil sauce and cooked a pizza.  I've found that in the heat of the summer I can use this oven vs. my gas oven and it cooks faster and doesn't heat up the house as much.  There is also a function that combines microwave and convection cooking to get meals done even faster... there are so many things this machine does, I've yet to figure them all out.<br />A nice feature, you can turn the turntable on/off depending on whether you have a round or rectangular dish.<br />The unit runs on regular 110 voltage, so no complicated rewiring.<br />GE, Kenmore and Samsung all have similar units -all made in Korea, all for the same price or more. I chose this microwave because I was tired of complaining about outsourcing of American jobs and wanted to support a company like Sharp that is still making some of their units here in the USA.",6/19/2004
49333634,R3UMRU0YZF8TNP,464779766,1,7,10,N,Don't even think about it,"This was bought as an emergency replacement for a wonderful Sharp combo oven.  The convection circulating fan had failed, and there was no time to have it repaired.  The fan motor simply needed to be replaced.  The microwave function still worked perfectly, but I needed the convection oven for holiday baking.  It was just before Thanksgiving and I couldn't find a replacement of the the Sharp locally, and no time for an on-line order.<br /><br />I found this Samsung locally, and it looked like it would fill the bill.  It did save me from holiday disaster, but I've been far from pleased with it.  You have to memorize ridiculous sequences of the controls that offer you only numbers as feedback so the manual near at hand is essential.  It will only accept two entries for sequence cooking; I used three much of the time in the Sharp for extraordinary results cooking rice and polenta.  Now I have to enter the first two stages, then the third after the first two are finished.<br /><br />The temperature of the convection mode is incredibly erratic; I set 200 degrees and when I checked the oven temperature during cooking it was at 350.  Today I set it at 400 (the maximum) and it never got above 350.  I think the control circuit board is failing because I looked at the clock when it was 6:12 and the oven clock read 10:something.  I reset the clock, then looked at it this evening at around 8:30 and it read 1:something.<br /><br />The only good thing about the appliance is that the beeper can be shut off.  (I hate those electronic beeps.)  As far as I'm concerned Samsung should stick to making phones and not try to produce products they don't have enough concern about to do well.  I will avoid the brand for appliances.",3/1/2015
19812610,R3ROW1FM562STG,464779766,4,5,5,Y,A Multi-Function Unit that is surprisingly good but not perfect! (The preheat setting is problematic to say the least),"I picked this unit up primarily for the Convection Oven function but have come to really appreciate its versatility. That said, the unit is not without issues.<br /><br />The short story is: the microwave function works perfectly and is perhaps a bit more powerful than my built in unit. The grill function is great - provided you use the pan that comes with the unit. The convection function is wonderful but never and I mean never use parchment paper in the unit. (FIRE!) The preheat function is problematic and 7 time out of 10 will cause your unit to stop working for at least 15 minute after it shuts off, especially if you interrupt it when it is the 10 minute post preheat time frame to try to use the convection oven setting. The unit is very sharp looking and feels solidly built. The two racks and accompanying pan are also reasonably well made.<br /><br />Now for those who are interested, the long story:<br /><br />Microwave:<br /><br />Works just great, seemed to have more power than my built in unit so I did a boil water test and found it got the water percolating about 30 seconds faster than my primary unit. The kids and I have learned to dial the time back when we use this unit.<br /><br />Grill:<br /><br />Love this feature, I made the following - Grilled Cheese (upper rack and pan - 7 minutes with flip at half way point) turned out beautifully. Open face bagel with cheese (upper rack and pan - 5 minutes) grilled to perfection.<br /><br />Convection Oven:<br /><br />I had pretty good but not perfect results here: Baked Russet Potatoes (medium) were only partially cooked after 30 minutes when cooked at the maximum 400 degree setting, my convection oven cooks them much more completely in the same amount of time at the same setting. Sweet Potato Fries were kind of a disappointment as well, they just did not crisp up like they do in my standard convection oven. Chicken Breasts and battered shrimp cooked in here were done more to my satisfaction but I did note that Ineeded to keep the temp up about 25 degrees hotter than my standard oven to get the same result. French bread pizzas were a complete disaster when cooked on parchment paper - the paper caught fire. I checked the manual about using parchment paper - I use it all the time in my standard oven for all sorts of baking - and there was no warning about using it - but I can tell you it is a big no-no.<br /><br />Preheat Function:<br /><br />Well, this function is pretty worthless on my unit. I have successfully been able to use it and then cook exactly 2 times out of 10 in the 2 weeks I have had the unit. The first time we used this function the house smelled like it was on fire, the unit quit working and we thought it had burned up. The next time we used it, it cycled through the preheat and then the 10 minute after preheat time period and then shut down. (It completely turns off, including the time display and will not work at all.) The next time I let it cycle through (both the preheat and 10 minute cycle), the unit remained functional and I was able to convection bake afterwards. Then the hubby ran the preheat and interrupted the 10 minute after preheat cycle to attempt to convection cook - the unit shut down again. As I said, we have tried this 10 different times and never been able to use the convection function directly after the preheating is done. Even waiting after the 10 minute period of time is dicey, sometimes the unit remains functional, sometimes it shuts down. The hubby is frankly worried about this and so we never leave the kitchen when the unit is in use.<br /><br />Slim Fry:<br /><br />We have not tried this function yet but I will update when we do, perhaps this is the answer to my issues with oven fries!<br /><br />Overall, this is a better multifunction machine than I thought it would be. I was highly skeptical of the convection oven side of the equation as my prior experiences with these sort of units (toaster oven/convection oven) have lead me to conclude that they are okay at best. The oven on this unit really does a decent job with some finagling on the temperature side. (Ignore the standard advise to lower by 25 degrees vs. regular oven on this unit and you should be fine.)  For the price the unit seems a solid investment, my only reservation being the preheat function which I think I will just chose to not use going forward.<br /><br />Recommended with above reservations.",1/16/2015
51401810,RKXNZX22HQZEE,464779766,3,182,192,Y,Takes your chef skills down a few notches,"Im always leery of appliances that blend several functions or operations into one device. My past experience has been that it is better to get one appliance that does one thing well than to get one appliance that does three things mediocre. But one thing I can say after running this Samsung multi-function baking, broiling, microwave, convection oven through its paces, is that it really does everything very, very well. Because the interface is not intuitive (more on this in a moment), you will have to spend some time with the manual to figure out how to cook things the correct way or the way you want to. You will also have to extrapolate a little bit, because Samsung does not cover every possible foodstuff and every possible cook method. Still, by keeping the manual handy, I didn't have any problem making delicious food in any of the modes that I tried (everything except broiling  which looks like it would be quite messy).<br /><br />I started simple, with the microwave. While every microwave that I have touched in the past twenty years was literally self-explanatory, just choose a setting or power level and cook time, this Samsung oven requires you to select the type of food, the weight, what you are trying to accomplish (heat, defrost, etc.) and it calculates everything for you and runs it. Now, this sounds like a lot of tedious work, and in fact it is. But the first thing I defrosted was frozen Japanese sticky rice. In a regular microwave, I usually just put it in at high level for a minute, stir it up, and I end up with a sometimes mushy, sometimes not, sometimes cold, or cool, or hot, sometimes perfect, sometimes inedible bowl of rice. Using the bread setting on the Samsung, I put the rice in, pushed the buttons and turned the knobs according to the instructions, and I ended up with perfectly defrosted, not hot, not cold, not a grain neglected bowl of rice. It was, in a word, amazing: defrosted without even getting hot. Wow. The microwave continued to impress in this fashion: popping popcorn, defrosting frozen berries, warming cold bread, all to perfection.<br /><br />For baking or actual heating, again, following the instructions of the manual, I made a number of excellent dishes. What I failed to notice, however, was that the cook times for everything I made were predetermined by the oven. That is to say, before starting I never knew how long anything would take and in fact, until you push the start button, the oven never indicates the cook time you are in for. Because these were main dishes and the length of time was not egregious, this didn't matter for the most part, until I tried the slim fry function.<br /><br />Now, I have experience with these so called oil-less fryers, which is essentially what the Samsung oven turns itself into in the slim fry mode. So, I prepped my potatoes and waited for my wife to come home before starting on the main dish prep, but before I did that, I started on the potatoes. The first step was to fast preheat the oven to 400 degrees, and it has a dedicated mode for accomplishing this. I turned it on and set to work on my other dishes. Eight minutes later, I was ready to go, but the oven was still fast (?) preheating. I cut to the chase, put in my potatoes on the crisper tray, set it on the small rack that came with the oven (is there a reason why the tray does not sit in a fixed position on its sister rack?), selected my quantity and hit start. The timer promptly displayed a cook time of 32 minutes. Wait, 32 minutes? I could drive to McDonalds, order fries, sit in the parking lot and eat them, go back in and get another order of fries and take them home to serve with dinner and Id still have 5 or 10 minutes before my slim fries were ready with the Samsung. We had a fry-less dinner, and slim fries (admittedly, delicious, crispy and light fries) for dessert.<br /><br />I dont know a serious chef who doesn't work within given time constraints. Its part of the task after all. (There are even television shows on which cook time determines the success or failure of the celebrity chefs competing on the shows.) So if you ask me, how, exactly, is a chef supposed to get the most out of this Samsung, I have to answer honestly, I have no clue. Not knowing the cook time up front is a serious handicap. I suppose if you used it enough for a wide range of foods under an extensive range of conditions, and kept notes along the way, you could develop an accurate chart of cook times that would allow you to get the most from this oven. But as it is, I think this is a nice microwave with a lot of great features that is hard to use for much of anything else. Samsung has some good ideas and a great microwave, but with the quirky implements, required-reading manual and the well let you know when it will be done when were ready to let you know feature, it is impossible to rate this any higher than three stars.e even television shows on which cook time determines the success or failure of the celebrity chefs competing on the shows.) So if you ask me, how, exactly, is a chef supposed to get the most out of this Samsung, I have to answer honestly, I have no clue. Not knowing the cook time up front is a serious handicap. I suppose if you used it enough for a wide range of foods under an extensive range of conditions, and kept notes along the way, you could develop an accurate chart of cook times that would allow you to get the most from this oven. But as it is, I think this is a nice microwave with a lot of great features that is hard to use for much of anything else. Samsung has some good ideas and a great microwave, but with the quirky implements, required-reading manual and the well let you know when it will be done when were ready to let you know feature, it is impossible to rate this any higher than three stars.",1/8/2015
51718901,RPNCLJWGOLNS2,464779766,5,3,4,Y,Exceeds expectations,"Setting it up it is the only issue.  It is very specifically for counter-top use only and it has an EXTREMELY short cord.  The cord doesn't even reach to the far side of the microwave.  Expect to need an extension cord.  The unit is a tiny bit smaller than average, but not much.  It has a pull down door that doesn't lay flush when opened, which may be a problem for larger dishes, but I've yet to encounter an issue.  There is an internal light that turns on when the unit is operating and when the door is open.  It runs a lot quieter than any microwave I've ever seen, and does so in all four modes (microwave, convection oven, air fryer, and toaster oven/grill).  There is no timer, which I found odd, but I've been using the phone for that for so long, I barely notice.<br /><br />The settings make it super easy to use.  You can auto-reheat a dinner plate or a casserole with a single feature.  There is a convenient popcorn button.  I've heard stories of a friend without that feature trying to pop up a bag of microwave popcorn.  Six people.  One microwave.  No viable popcorn.  No such problem here.  One button and let it pop.<br /><br />There are also auto-cook features for pasta, beverage, chicken breast, frozen breakfast, and frozen dinner.  What? No frozen lunch?<br /><br />The air fry (or slim fry, however you want to call it) feature worked well for me, though I only tried homemade french fries.  It only works for this list of pre-programmed items:<br /><br />Frozen oven chips (aka french fries)<br />Frozen breaded prawns<br />Frozen chicken nuggets<br />Frozen potato croquettes<br />Frozen onion rings<br />Chicken wings<br />Homemade french fries (there is a recipe in the guide and it's good to read it first if you've never air fried these before)<br />Potato wedges<br />Drumsticks<br /><br />For using it as a toaster oven, or grill (it seems like they use the terms interchangeably) you put the thing you want to toast/grill on the high rack (included, as is the lower rack) and select grill.  For medium dark toast, I go three minutes on each side.  It comes it shockingly good, same as from any toaster.  I had low expectations for that one, but it worked really well.<br /><br />Overall, it does everything it says it does, and it does it very well.",1/8/2015
32483321,R2T6PILHX8VPIR,464779766,4,2,4,Y,"Really like the microwave, a bit torn on the other features","First off, my family and I are very happy with the microwave portion of the Samsung Counter Top Convection Microwave.  It looks great in our kitchen and the stainless steel matches our major appliances.  The black ceramic interior is also a nice touch - looks great and should be easy to clean.  The turntable is a bit larger than that of the countertop microwave it replaced, and in operation the microwave is very quiet.  One downside of this particular unit is it isn't the most powerful microwave out there - rated for 1000 watts compared to other 1200 and 1250 watt microwaves in this price range.  However, it is sufficient for home cooking tasks.  Setting the power and time is easy.<br /><br />The other function we've tried is the convection oven.  We used it to cook some frozen hors d'oeuvres (fancy name for pigs in a blanket) using the included metal racks and ceramic crusty plate.  Even though we preheated the oven as directed, we found we had to cook our food far longer than expected based on the time listed on the package, so there was no real time savings over using our conventional oven.  In addition, the exterior of the unit becomes *very* hot when using this mode.  I suspect that we will not be using the convection mode very often, though it is a nice feature to have.<br /><br />As for the Slim Fry / grilling / combined cooking modes, I have not tried these yet and I'm not sure I will.  These modes *seem* to use both microwave and convection heating, but it isn't clear how much of each from the very short included manual.  It is also very unclear when the included metal racks and crisping plate should and should not be used.  (Even looking through reviews and questions here you can see that Samsung is giving very inconsistent information on this subject.)  In any event, I will take other reviewers word for it that Slim Fry is a mediocre substitute for actual frying.  As for grilling, the grill elements only reach the back third of the oven, and I'm not sure it is worth the inevitable mess created to try grilling in this oven.<br /><br />So overall I would give this Samsung four stars for microwave cooking, three stars for convection cooking, and two stars for the other functions.  Four stars overall since it does its main job very well.h the inevitable mess created to try grilling in this oven.    So overall I would give this Samsung four stars for microwave cooking, three stars for convection cooking, and two stars for the other functions.  Four stars overall since it does its main job very well.",1/5/2015
51899704,R1CNON69VWOU0,464779766,5,0,1,Y,"High Quality, Large!","This is a lovely oven, also a microwave; I have used this for a variety of purposes, as an adjunct to my regular oven and microwave.<br /><br />I would suggest this as an excellent choice for a counter top oven and microwave, but.... make sure that you have the counter space.  This is quite large, and the venting in the rear requires some space (I could not put it in a special shelf for the microwave I had, because of the venting).  For that reason, I would give this 4.5 stars, as it is not nimble, and is a counter hog.",1/5/2015
39220433,RTSIB49LN0D2L,464779766,4,3,3,Y,It comes with metal racks? What next? A TV without a dial?,"To address the leading question:<br /><br />Yes, metal racks. That work, during the use of the microwave function. And the universe does not condense into a singularity and explode. What else from my childhood has changed? Do you no longer have to turn the dial on a phone to make a call? Drop a dime in the slot to call someone from a payphone?<br /><br />Anyway: yes, there are metal racks for the microwave and the other function. Follow the instructions.<br /><br />Here's the skinny:<br /><br />This is more than just a microwave. You can see in the description all of the functions--and they all work pretty close to as they are described.<br /><br />That's the first real issue with the &#34;Smart Oven,&#34; as the box labels it: the descriptions on the webpage here? They're almost as complete as the instruction manual. There's a bit more, but overall I would have liked a bit more in terms of device ideas and how to utilize it. Especially with the concepts/cooking types involved. I think the Slim-Fry concept is great, but I'd like to understand how it's working better so that I can do more than chicken wings and fries.<br /><br />You will also note several comments on the lack of timer. It's true: no &#34;non-cooking timer.&#34;<br /><br />In exchange, though, you can actually generate a crispy crust on that microwave pizza.<br /><br />The drop-down door is nice, but keep it in mind as you handle placement. On a countertop, it drops down flush but this does require that the oven is a little taller than my previous microwave.<br /><br />Functionally, I'd like a better option when using the grill or Slim-Fry settings than letting the grease/food drippings to just drop down onto the turntable. Especially because that thing gets wicked hot (as is reasonable) so you have to wait a while to pull it and clean it.<br /><br />But the functions work well, so that's the main thing.<br /><br />In all...great oven. Not perfect, but I've never met a perfect microwave.",1/3/2015
